Team,Player,Pos,Status,Reported,ImpactMultiplier,AutoAdjEM_delta,Source,Note
Alabama,Keitenn Bristow,F,Out,Feb 6,,-0.07,covers_raw:injuries_raw.txt,is out indefinitely Bristow is out with undisclosed
Alabama,Davion Hannah,G,Out,Feb 6,,-0.07,covers_raw:injuries_raw.txt,is out indefinitely Hannah is out with undisclosed
Alabama,Collins Onyejiaka,C,Out,Jan 21,,-0.07,covers_raw:injuries_raw.txt,is out indefinitely Onyejiaka is out with undisclosed
Appalachian St.,KJ Vasser,G,Out for season,Jan 21,,-0.1,covers_raw:injuries_raw.txt,is out for season Vasser is out for season with foot
Arizona St.,Adante' Holiman,G,Out,Jan 21,,-0.07,covers_raw:injuries_raw.txt,is out indefinitely Holiman is out with elbow
Arizona St.,Vijay Wallace,G,Out for season,Jan 21,,-0.1,covers_raw:injuries_raw.txt,is out for season Wallace is out for season with ankle
Arizona St.,Dame Salane,C,Out for season,Jan 21,,0.0,covers_raw:injuries_raw.txt,is out for season Salane is out for season with redshirt
Arkansas,Karter Knox,F,Out,Feb 20,,-0.07,covers_raw:injuries_raw.txt,is out indefinitely Knox is out with undisclosed
Auburn,Emeka Opurum,C,Out for season,Jan 21,,-0.1,covers_raw:injuries_raw.txt,is out for season Opurum is out for season with undisclosed
BYU,Dawson Baker,G,Out for season,Jan 21,,-0.1,covers_raw:injuries_raw.txt,is out for season Baker is out for season with knee
BYU,Richie Saunders,G,Out for season,Feb 17,,-0.1,covers_raw:injuries_raw.txt,is out for season Saunders is out for season with knee
BYU,Nate Pickens,G,Out for season,Jan 21,,-0.1,covers_raw:injuries_raw.txt,is out for season Pickens is out for season with undisclosed
BYU,Brody Kozlowski,F,Questionable,Mar 11,,-0.01,covers_raw:injuries_raw.txt,"is ""?"" Thursday vs Houston U Kozlowski is questionable with undisclosed"
BYU,Xavion Staton,C,Questionable,Mar 11,,-0.01,covers_raw:injuries_raw.txt,"is ""?"" Thursday vs Houston U Staton is questionable with undisclosed"
BYU,KJ Perry,G,Out for season,Jan 21,,0.0,covers_raw:injuries_raw.txt,is out for season Perry is out for season with redshirt
Baylor,JJ White,G,Questionable,Mar 10,,-0.01,covers_raw:injuries_raw.txt,"is ""?"" White is questionable with undisclosed"
Baylor,Juslin Bodo Bodo,C,Out for season,Jan 21,,-0.1,covers_raw:injuries_raw.txt,is out for season Bodo Bodo is out for season with arm
Baylor,Maikcol Perez,F,Out for season,Jan 21,,-0.1,covers_raw:injuries_raw.txt,is out for season Perez is out for season with knee
Belmont,Nic McClain,G,Out,Jan 21,,-0.07,covers_raw:injuries_raw.txt,is out indefinitely McClain is out with undisclosed
Bethune-Cookman,Daniel Rouzan,F,Questionable,Mar 11,,-0.01,covers_raw:injuries_raw.txt,"is ""?"" to return Wednesday vs Prairie View A&M Rouzan is questionable with hand"
Boise St.,Julian Bowie,G,Out for season,Jan 21,,-0.1,covers_raw:injuries_raw.txt,is out for season Bowie is out for season with personal
Boston College,Donald Hand,G,Questionable,Mar 7,,-0.01,covers_raw:injuries_raw.txt,"left last game, is ""?"" Hand is questionable with leg"
Boston College,Jason Asemota,F,Questionable,Mar 7,,-0.01,covers_raw:injuries_raw.txt,"is ""?"" Asemota is questionable with undisclosed"
Boston College,Nick Petronio,G,Out,Jan 21,,-0.07,covers_raw:injuries_raw.txt,is out indefinitely Petronio is out with undisclosed
Boston University,Malcolm Chimezie,F,Questionable,Mar 8,,-0.01,covers_raw:injuries_raw.txt,"is ""?"" Wednesday vs Lehigh Chimezie is questionable with knee"
Boston University,Kyrone Alexander,G,Out,Jan 21,,-0.07,covers_raw:injuries_raw.txt,is out indefinitely Alexander is out with leg
Bradley,Matthew Zobrist,G,Questionable,Mar 7,,-0.01,covers_raw:injuries_raw.txt,"is ""?"" Zobrist is questionable with undisclosed"
Butler,Azavier Robinson,G,Out for season,Feb 11,,-0.1,covers_raw:injuries_raw.txt,is out for season Robinson is out for season with wrist
California,Rytis Petraitis,F,Out for season,Jan 21,,-0.1,covers_raw:injuries_raw.txt,is out for season Petraitis is out for season with leg
California,Stephon Marbury,G,Out,Mar 11,,-0.05,covers_raw:injuries_raw.txt,is downgraded to OUT Wednesday vs Florida State Marbury is out with undisclosed
California,Jovani Ruff,G,Out,Mar 11,,-0.05,covers_raw:injuries_raw.txt,is downgraded to OUT Wednesday vs Florida State Ruff is out with undisclosed
Charleston,Will Mortimore,F,Out,Jan 21,,-0.07,covers_raw:injuries_raw.txt,is out indefinitely Mortimore is out with concussion
Charlotte,Ethan Butler,F,Questionable,Mar 11,,-0.01,covers_raw:injuries_raw.txt,"is ""?"" Thursday vs Tulane Butler is questionable with undisclosed"
Charlotte,Damoni Harrison,G,Questionable,Mar 11,,-0.01,covers_raw:injuries_raw.txt,"is ""?"" Thursday vs Tulane Harrison is questionable with undisclosed"
Charlotte,Major Freeman,G,Questionable,Mar 11,,-0.01,covers_raw:injuries_raw.txt,"is ""?"" Thursday vs Tulane Freeman is questionable with undisclosed"
Charlotte,David Gomez,F,Questionable,Mar 11,,-0.01,covers_raw:injuries_raw.txt,"is ""?"" Thursday vs Tulane Gomez is questionable with undisclosed"
Charlotte,Frank Oguche,G,Out,Jan 30,,-0.07,covers_raw:injuries_raw.txt,is out indefinitely Oguche is out with undisclosed
Cincinnati,Jalen Haynes,F,Out for season,Feb 9,,-0.1,covers_raw:injuries_raw.txt,is out for season Haynes is out for season with lower body
Clemson,Carter Welling,F,Questionable,Mar 12,,-0.01,covers_raw:injuries_raw.txt,"is ""?"" Thursday vs North Carolina Welling is questionable with knee"
Clemson,Zac Foster,G,Out for season,Jan 21,,-0.1,covers_raw:injuries_raw.txt,is out for season Foster is out for season with knee
Clemson,Trent Steinour,F/C,Questionable,Mar 12,,-0.01,covers_raw:injuries_raw.txt,"is ""?"" Thursday vs North Carolina Steinour is questionable with undisclosed"
Cleveland St.,Josiah Harris,F,Questionable,Mar 5,,-0.01,covers_raw:injuries_raw.txt,"is ""?"" Harris is questionable with concussion"
Cleveland St.,Dayan Nessah,F,Questionable,Mar 5,,-0.01,covers_raw:injuries_raw.txt,"is ""?"" Nessah is questionable with shoulder"
Colorado,Sebastian Rancik,F,Questionable,Mar 11,,-0.01,covers_raw:injuries_raw.txt,"is ""?"" Rancik is questionable with undisclosed"
Colorado,Jon Mani,G,Out for season,Jan 21,,0.0,covers_raw:injuries_raw.txt,is out for season Mani is out for season with redshirt
Colorado,Leonardo Van Elswyk,C,Out for season,Jan 21,,0.0,covers_raw:injuries_raw.txt,is out for season Van Elswyk is out for season with redshirt
Connecticut,Jaylin Stewart,F,Out,Mar 10,,-0.07,covers_raw:injuries_raw.txt,is out indefinitely Stewart is out with undisclosed
Creighton,Liam McChesney,F,Out,Jan 21,,-0.07,covers_raw:injuries_raw.txt,is out indefinitely McChesney is out with undisclosed
Creighton,Owen Freeman,F,Questionable,Mar 4,,-0.01,covers_raw:injuries_raw.txt,"is ""?"" Freeman is questionable with undisclosed"
Creighton,Josh Townley-Thomas,F,Questionable,Mar 4,,-0.01,covers_raw:injuries_raw.txt,"is ""?"" Townley-Thomas is questionable with undisclosed"
Creighton,Jackson McAndrew,F,Out for season,Jan 21,,-0.1,covers_raw:injuries_raw.txt,is out for season McAndrew is out for season with foot
Creighton,Aleksa Dimitrijevic,C,Out for season,Jan 21,,0.0,covers_raw:injuries_raw.txt,is out for season Dimitrijevic is out for season with redshirt
Davidson,Joe Hurlburt,F/C,Out,Feb 6,,-0.07,covers_raw:injuries_raw.txt,is out indefinitely Hurlburt is out with undisclosed
Davidson,Josh Scovens,G,Questionable,Mar 7,,-0.01,covers_raw:injuries_raw.txt,"is ""?"" Scovens is questionable with undisclosed"
Davidson,Roberts Blums,G,Questionable,Mar 7,,-0.01,covers_raw:injuries_raw.txt,"is ""?"" Blums is questionable with undisclosed"
Dayton,Evan Dickey,G,Questionable,Mar 6,,-0.01,covers_raw:injuries_raw.txt,"is ""?"" Dickey is questionable with undisclosed"
Dayton,Jaron McKie,G,Out for season,Feb 27,,-0.1,covers_raw:injuries_raw.txt,is out for season McKie is out for season with shoulder
DePaul,Jeremy Lorenz,F,Out,Jan 21,,-0.07,covers_raw:injuries_raw.txt,is out indefinitely Lorenz is out with hip
DePaul,Amsal Delalic,G,Out for season,Jan 21,,-0.1,covers_raw:injuries_raw.txt,is out for season Delalic is out for season with knee
Delaware,Jameel Brown,G,Questionable,Mar 5,,-0.01,covers_raw:injuries_raw.txt,"is ""?"" Brown is questionable with undisclosed"
Delaware,Tyler Houser,F,Out for season,Feb 27,,-0.1,covers_raw:injuries_raw.txt,is out for season Houser is out for season with undisclosed
Delaware,Cavan Reilly,G,Out,Feb 14,,-0.07,covers_raw:injuries_raw.txt,is out indefinitely Reilly is out with undisclosed
Delaware,Lance Piper,G,Out,Feb 14,,-0.07,covers_raw:injuries_raw.txt,is out indefinitely Piper is out with undisclosed
Delaware,Bouna Kebe,F,Questionable,Mar 5,,-0.01,covers_raw:injuries_raw.txt,"is ""?"" Kebe is questionable with undisclosed"
Delaware,Mason Ellison,G,Out,Feb 12,,-0.07,covers_raw:injuries_raw.txt,is out indefinitely Ellison is out with thumb
Duke,Ifeanyi Ufochukwu,C,Questionable,Mar 11,,-0.01,covers_raw:injuries_raw.txt,"is ""?"" Thursday vs Florida State Ufochukwu is questionable with undisclosed"
Duke,Caleb Foster,G,Out,Mar 10,,-0.07,covers_raw:injuries_raw.txt,is out indefinitely Foster is out with foot
Duke,Patrick Ngongba,C,Out,Mar 10,,-0.05,covers_raw:injuries_raw.txt,is OUT for ACC Tournament Ngongba is out with undisclosed
Duquesne,Stef van Bussel,C,Questionable,Mar 7,,-0.01,covers_raw:injuries_raw.txt,"is ""?"" van Bussel is questionable with undisclosed"
East Carolina,Eli DeLaurier,F,Questionable,Mar 8,,-0.01,covers_raw:injuries_raw.txt,"is ""?"" DeLaurier is questionable with undisclosed"
East Carolina,Tybo Bailey,G,Questionable,Mar 8,,-0.01,covers_raw:injuries_raw.txt,"is ""?"" Bailey is questionable with undisclosed"
East Carolina,Trevion LaBeaux,G/F,Out for season,Jan 21,,-0.1,covers_raw:injuries_raw.txt,is out for season LaBeaux is out for season with lower body
East Carolina,Jayshayne Woodard,G,Out,Jan 21,,-0.07,covers_raw:injuries_raw.txt,is out indefinitely Woodard is out with ankle
East Carolina,Daithi Quinn,G,Out for season,Jan 21,,-0.1,covers_raw:injuries_raw.txt,is out for season Quinn is out for season with knee
Eastern Washington,Andrew Cook,G,Out for season,Jan 21,,-0.1,covers_raw:injuries_raw.txt,is out for season Cook is out for season with ankle
Florida Atlantic,Devin Vanterpool,G,Questionable,Mar 12,,-0.01,covers_raw:injuries_raw.txt,"is ""?"" Thursday vs North Texas Vanterpool is questionable with ankle"
Florida Atlantic,Zion Sampaio,G,Out for season,Jan 21,,-0.1,covers_raw:injuries_raw.txt,is out for season Sampaio is out for season with undisclosed
FIU,Amarion Nimmers,G,Out for season,Mar 7,,-0.1,covers_raw:injuries_raw.txt,is out for season Nimmers is out for season with undisclosed
FIU,Gvidas Gicevicius,F,Out for season,Jan 21,,-0.1,covers_raw:injuries_raw.txt,is out for season Gicevicius is out for season with undisclosed
Florida St.,AJ Swinton,F,Out for season,Mar 7,,-0.1,covers_raw:injuries_raw.txt,is out for season Swinton is out for season with knee
Florida St.,Xavier Osceola,G,Questionable,Mar 11,,-0.01,covers_raw:injuries_raw.txt,"is ""?"" Thursday vs Duke Osceola is questionable with undisclosed"
Fordham,Ryan Pettis,G,Out,Jan 21,,-0.07,covers_raw:injuries_raw.txt,is out indefinitely Pettis is out with undisclosed
Fordham,Jack Whitbourn,C,Questionable,Mar 12,,-0.01,covers_raw:injuries_raw.txt,"is ""?"" Thursday vs Geo Washington Whitbourn is questionable with undisclosed"
Fresno St.,Nathan Zulemie,G,Out for season,Mar 12,,-0.1,covers_raw:injuries_raw.txt,is out for season Zulemie is out for season with undisclosed
George Mason,Brayden O'Connor,G,Out for season,Feb 16,,-0.1,covers_raw:injuries_raw.txt,is out for season O'Connor is out for season with foot
George Mason,Jermahri Hill,G,Questionable,Mar 7,,-0.01,covers_raw:injuries_raw.txt,"is ""?"" Hill is questionable with undisclosed"
George Washington,Ty Bevins,G,Questionable,Mar 12,,-0.01,covers_raw:injuries_raw.txt,"is ""?"" Thursday vs Fordham Bevins is questionable with undisclosed"
George Washington,Jalen Rougier-Roane,G,Out for season,Feb 27,,-0.1,covers_raw:injuries_raw.txt,is out for season Rougier-Roane is out for season with undisclosed
Georgetown,KJ Lewis,G,Out for season,Feb 27,,-0.1,covers_raw:injuries_raw.txt,is out for season Lewis is out for season with ankle
Georgia St.,Clash Peters,F,Out for season,Jan 21,,-0.1,covers_raw:injuries_raw.txt,is out for season Peters is out for season with personal
Georgia Tech,Dyllan Thompson,G/F,Questionable,Mar 7,,-0.01,covers_raw:injuries_raw.txt,"is ""?"" Thompson is questionable with undisclosed"
Georgia Tech,Mouhamed Sylla,C,Out,Feb 6,,-0.07,covers_raw:injuries_raw.txt,is out indefinitely Sylla is out with undisclosed
Gonzaga,Braden Huff,F,Out,Jan 21,,-0.07,covers_raw:injuries_raw.txt,is out indefinitely Huff is out with knee
Grand Canyon,Wilhelm Breidenbach,F,Out,Mar 12,,-0.05,covers_raw:injuries_raw.txt,is downgraded to OUT Thursday vs Nevada Breidenbach is out with undisclosed
Hawaii,Aaron Hunkin-Claytor,G,Out for season,Feb 8,,-0.1,covers_raw:injuries_raw.txt,is out for season Hunkin-Claytor is out for season with toe
Illinois,Jason Jakstys,C,Out for season,Feb 1,,-0.1,covers_raw:injuries_raw.txt,is out for season Jakstys is out for season with undisclosed
Indiana,Jason Drake,G,Out,Jan 21,,-0.07,covers_raw:injuries_raw.txt,is out indefinitely Drake is out with foot
Indiana,Jordan Rayford,G,Out for season,Jan 21,,-0.1,covers_raw:injuries_raw.txt,is out for season Rayford is out for season with undisclosed
Indiana St.,Zyair Greene,G,Questionable,Mar 5,,-0.01,covers_raw:injuries_raw.txt,"is ""?"" Greene is questionable with undisclosed"
Indiana St.,Jayan Walker,G,Questionable,Mar 5,,-0.01,covers_raw:injuries_raw.txt,"is ""?"" Walker is questionable with undisclosed"
Iowa,Peyton McCollum,G,Out for season,Jan 21,,-0.1,covers_raw:injuries_raw.txt,is out for season McCollum is out for season with undisclosed
Iowa St.,Xzavion Mitchell,F,Questionable,Mar 11,,-0.01,covers_raw:injuries_raw.txt,"is ""?"" Thursday vs Texas Tech Mitchell is questionable with undisclosed"
Jackson St.,Daeshun Ruffin,G,Questionable,Mar 11,,-0.01,covers_raw:injuries_raw.txt,"is ""?"" Wednesday vs Florida A&M Ruffin is questionable with leg"
Jacksonville St.,Bencao Vungo,G/F,Out,Jan 21,,-0.07,covers_raw:injuries_raw.txt,is out indefinitely Vungo is out with undisclosed
Jacksonville St.,Jordan Vick,G,Out,Jan 21,,-0.07,covers_raw:injuries_raw.txt,is out indefinitely Vick is out with undisclosed
Kansas St.,Abdi Bashir,G,Out,Mar 10,,-0.05,covers_raw:injuries_raw.txt,is downgraded to OUT Tuesday vs BYU Bashir is out with undisclosed
Kansas St.,Mobi Ikegwuruka,G,Out,Mar 10,,-0.05,covers_raw:injuries_raw.txt,is downgraded to OUT Tuesday vs BYU Ikegwuruka is out with undisclosed
Kansas St.,Dorin Buca,C,Out,Mar 10,,-0.05,covers_raw:injuries_raw.txt,is downgraded to OUT Tuesday vs BYU Buca is out with undisclosed
Kennesaw St.,Chase Clemmons,G,Out for season,Jan 21,,-0.1,covers_raw:injuries_raw.txt,is out for season Clemmons is out for season with undisclosed
Kennesaw St.,Brendan Tousignaut,G,Out for season,Jan 21,,-0.1,covers_raw:injuries_raw.txt,is out for season Tousignaut is out for season with undisclosed
Kennesaw St.,Darius Washington,G,Questionable,Mar 7,,-0.01,covers_raw:injuries_raw.txt,"is ""?"" Washington is questionable with undisclosed"
Kentucky,Jaland Lowe,G,Out for season,Jan 21,,-0.1,covers_raw:injuries_raw.txt,is out for season Lowe is out for season with arm
Kentucky,Jayden Quaintance,F,Out,Jan 25,,-0.07,covers_raw:injuries_raw.txt,is out indefinitely Quaintance is out with knee
LSU,Dedan Thomas,G,Out for season,Feb 14,,-0.1,covers_raw:injuries_raw.txt,is out for season Thomas is out for season with foot
Louisiana,Jamyron Keller,G,Out for season,Jan 21,,-0.1,covers_raw:injuries_raw.txt,is out for season Keller is out for season with foot
Louisiana,Sean Elkinton,F,Out for season,Jan 21,,-0.1,covers_raw:injuries_raw.txt,is out for season Elkinton is out for season with foot
Louisiana Tech,Will Jeffress,F,Out for season,Feb 28,,-0.1,covers_raw:injuries_raw.txt,is out for season Jeffress is out for season with knee
Louisiana Tech,A'Meir Williams,F,Out for season,Jan 21,,-0.1,covers_raw:injuries_raw.txt,is out for season Williams is out for season with undisclosed
Louisville,Mikel Brown,G,Out indefinitely,Mar 12,,-0.07,covers_raw:injuries_raw.txt,is OUT for ACC tournament Brown is injured with back
Louisville,Dominick Harris,G,Out,Feb 6,,-0.07,covers_raw:injuries_raw.txt,is out indefinitely Harris is out with undisclosed
Louisville,Kymany Houinsou,G,Questionable,Mar 11,,-0.01,covers_raw:injuries_raw.txt,"is ""?"" Thursday vs Davidson Houinsou is questionable with undisclosed"
Louisville,Caleb Reese,G,Questionable,Mar 11,,-0.01,covers_raw:injuries_raw.txt,"is ""?"" Thursday vs Davidson Reese is questionable with undisclosed"
Louisville,Justin Moore,G,Questionable,Mar 11,,-0.01,covers_raw:injuries_raw.txt,"is ""?"" Thursday vs Davidson Moore is questionable with undisclosed"
Louisville,Chuck Love,G,Out,Feb 6,,-0.07,covers_raw:injuries_raw.txt,is out indefinitely Love is out with undisclosed
Marist,Jason Schofield,C,Out,Feb 22,,-0.07,covers_raw:injuries_raw.txt,is out indefinitely Schofield is out with knee
Marist,Elijah Lewis,G,Out for season,Feb 13,,-0.1,covers_raw:injuries_raw.txt,is out for season Lewis is out for season with knee
Marist,Tarik Watson,C,Out,Feb 5,,-0.07,covers_raw:injuries_raw.txt,is out indefinitely Watson is out with knee
Marquette,Sean Jones,G,Out for season,Feb 24,,-0.1,covers_raw:injuries_raw.txt,is out for season Jones is out for season with foot
Massachusetts,Dimitri Clerc,F/C,Questionable,Mar 3,,-0.01,covers_raw:injuries_raw.txt,"is ""?"" Clerc is questionable with leg"
Memphis,Ashton Hardaway,F,Doubtful,Mar 11,,-0.03,covers_raw:injuries_raw.txt,is not in the starting lineup Wednesday vs Tulane Hardaway is doubtful with calf
Memphis,Julius Thedford,G,Doubtful,Mar 11,,-0.03,covers_raw:injuries_raw.txt,is not in the starting lineup Wednesday vs Tulane Thedford is doubtful with undisclosed
Miami FL,Marcus Allen,G/F,Out for season,Jan 21,,-0.1,covers_raw:injuries_raw.txt,is out for season Allen is out for season with illness
Miami FL,Treyvon Maddox,F,Out,Jan 21,,-0.07,covers_raw:injuries_raw.txt,is out indefinitely Maddox is out with undisclosed
Michigan St.,Kaleb Glenn,F,Out for season,Jan 21,,-0.1,covers_raw:injuries_raw.txt,is out for season Glenn is out for season with knee
Michigan St.,Divine Ugochukwu,G,Out for season,Feb 6,,-0.1,covers_raw:injuries_raw.txt,is out for season Ugochukwu is out for season with foot
Michigan,Charlie May,G,Out for season,Jan 21,,-0.1,covers_raw:injuries_raw.txt,is out for season May is out for season with thumb
Michigan,L.J. Cason,G,Out for season,Feb 28,,-0.1,covers_raw:injuries_raw.txt,is out for season Cason is out for season with knee
Minnesota,Robert Vaihola,F,Out for season,Jan 21,,-0.1,covers_raw:injuries_raw.txt,is out for season Vaihola is out for season with knee
Minnesota,BJ Omot,F,Out for season,Jan 24,,-0.1,covers_raw:injuries_raw.txt,is out for season Omot is out for season with leg
Minnesota,Chance Stephens,G,Out,Jan 21,,-0.07,covers_raw:injuries_raw.txt,is out indefinitely Stephens is out with illness
Minnesota,Jaylen Crocker-Johnson,F,Out,Feb 20,,-0.07,covers_raw:injuries_raw.txt,is out indefinitely Crocker-Johnson is out with foot
Mississippi St.,Gai Chol,C,Out for season,Jan 21,,-0.1,covers_raw:injuries_raw.txt,is out for season Chol is out for season with knee
Mississippi St.,King Grace,G,Questionable,Mar 11,,-0.01,covers_raw:injuries_raw.txt,"is ""?"" Grace is questionable with undisclosed"
Missouri St.,Antwan Burnett,G/F,Questionable,Mar 11,,-0.01,covers_raw:injuries_raw.txt,"is ""?"" Burnett is questionable with undisclosed"
Missouri St.,Amar Kuljuhovic,G/F,Out,Jan 21,,-0.07,covers_raw:injuries_raw.txt,is out indefinitely Kuljuhovic is out with undisclosed
Missouri,Jevon Porter,F,Out,Jan 21,,-0.07,covers_raw:injuries_raw.txt,is out indefinitely Porter is out with lower body
Missouri,Annor Boateng,G,Out for season,Feb 4,,-0.1,covers_raw:injuries_raw.txt,is out for season Boateng is out for season with leg
Mount St. Mary's,Jaxon Hartman,G,Out,Mar 1,,-0.07,covers_raw:injuries_raw.txt,is out indefinitely Hartman is out with undisclosed
Mount St. Mary's,Abdou Khadre Kebe,G,Out,Mar 1,,-0.07,covers_raw:injuries_raw.txt,is out indefinitely Khadre Kebe is out with undisclosed
Mount St. Mary's,Justin May,G,Out,Mar 1,,-0.07,covers_raw:injuries_raw.txt,is out indefinitely May is out with undisclosed
Nebraska,Henry Burt,F,Out,Jan 21,,-0.07,covers_raw:injuries_raw.txt,is out indefinitely Burt is out with knee
Nebraska,Connor Essegian,G,Out for season,Jan 21,,-0.1,covers_raw:injuries_raw.txt,is out for season Essegian is out for season with ankle
Nebraska,Ugnius Jarusevicius,F,Out,Feb 13,,-0.07,covers_raw:injuries_raw.txt,is out indefinitely Jarusevicius is out with back
New Mexico,Chris Howell,G,Questionable,Mar 7,,-0.01,covers_raw:injuries_raw.txt,"is ""?"" Howell is questionable with undisclosed"
New Mexico,Milos Vicentic,F,Questionable,Mar 7,,-0.01,covers_raw:injuries_raw.txt,"is ""?"" Vicentic is questionable with undisclosed"
North Carolina,Alyn Breed,G,Questionable,Mar 11,,-0.01,covers_raw:injuries_raw.txt,"is ""?"" Thursday vs Virginia Breed is questionable with undisclosed"
North Carolina,Colt Langdon,F,Questionable,Mar 11,,-0.01,covers_raw:injuries_raw.txt,"is ""?"" Thursday vs Virginia Langdon is questionable with undisclosed"
North Carolina,James Brown,C,Out for season,Feb 20,,-0.1,covers_raw:injuries_raw.txt,is out for season Brown is out for season with foot
North Carolina,Ivan Matlekovic,C,Questionable,Mar 7,,-0.01,covers_raw:injuries_raw.txt,"is ""?"" Matlekovic is questionable with undisclosed"
North Carolina,Caleb Wilson,F,Out for season,Mar 6,,-0.1,covers_raw:injuries_raw.txt,is out for season Wilson is out for season with thumb
North Texas,Will McClendon,G,Out for season,Jan 21,,-0.1,covers_raw:injuries_raw.txt,is out for season McClendon is out for season with leg
Northern Iowa,Marino Dubravcic,F,Out,Jan 21,,-0.07,covers_raw:injuries_raw.txt,is out indefinitely Dubravcic is out with undisclosed
Northern Iowa,Cade Courbat,G,Out,Jan 21,,-0.07,covers_raw:injuries_raw.txt,is out indefinitely Courbat is out with undisclosed
Northwestern,Arrinten Page,F,Questionable,Mar 11,,-0.01,covers_raw:injuries_raw.txt,"is ""?"" Thursday vs Purdue Page is questionable with illness"
Notre Dame,Markus Burton,G,Out,Jan 21,,-0.07,covers_raw:injuries_raw.txt,is out indefinitely Burton is out with foot
Notre Dame,Tommy Ahneman,C,Out,Jan 21,,-0.07,covers_raw:injuries_raw.txt,is out indefinitely Ahneman is out with knee
Ohio,Elijah Elliott,G,Out,Mar 7,,-0.07,covers_raw:injuries_raw.txt,is out indefinitely Elliott is out with undisclosed
Ohio St.,Puff Johnson,G/F,Probable,Mar 12,,0.0,covers_raw:injuries_raw.txt,is upgraded to probable Thursday vs Iowa Johnson is probable with achilles
Ohio St.,Brandon Noel,F,Probable,Mar 12,,0.0,covers_raw:injuries_raw.txt,is upgraded to probable Thursday vs Iowa Noel is probable with foot
Ohio St.,Josh Ojianwuna,F,Out,Jan 21,,-0.07,covers_raw:injuries_raw.txt,is out indefinitely Ojianwuna is out with knee
Ohio St.,Myles Herro,G,Out for season,Jan 21,,0.0,covers_raw:injuries_raw.txt,is out for season Herro is out for season with redshirt
Oklahoma St.,Parsa Fallah,F,Out for season,Feb 25,,-0.1,covers_raw:injuries_raw.txt,is out for season Fallah is out for season with knee
Old Dominion,Caelum Swanton-Rodger,F,Questionable,Mar 4,,-0.01,covers_raw:injuries_raw.txt,"left last game, is ""?"" Wednesday vs Georgia Southern Swanton-Rodger is questionable with ankle"
Mississippi,Koren Johnson,G,Questionable,Mar 11,,-0.01,covers_raw:injuries_raw.txt,"is ""?"" Thursday vs Georgia Johnson is questionable with undisclosed"
Oregon,Jackson Shelstad,G,Out,Jan 21,,-0.07,covers_raw:injuries_raw.txt,is out indefinitely Shelstad is out with hand
Oregon,Devon Pryor,F,Out,Feb 2,,-0.07,covers_raw:injuries_raw.txt,is out indefinitely Pryor is out with groin
Oregon,JJ Frakes,G,Questionable,Mar 10,,-0.01,covers_raw:injuries_raw.txt,"is ""?"" Frakes is questionable with undisclosed"
Oregon,Ege Demir,C,Out for season,Feb 2,,-0.1,covers_raw:injuries_raw.txt,is out for season Demir is out for season with undisclosed
Penn St.,Reggie Grodin,G,Out for season,Jan 21,,-0.1,covers_raw:injuries_raw.txt,is out for season Grodin is out for season with undisclosed
Penn St.,Tibor Mirtic,F,Out for season,Feb 27,,-0.1,covers_raw:injuries_raw.txt,is out for season Mirtic is out for season with leg
Penn,Dylan Williams,G,Out,Jan 21,,-0.07,covers_raw:injuries_raw.txt,is out indefinitely Williams is out with undisclosed
Penn,Ryan Altman,G/F,Out,Jan 30,,-0.07,covers_raw:injuries_raw.txt,is out indefinitely Altman is out with undisclosed
Portland,Riley Parker,G,Out for season,Jan 29,,-0.1,covers_raw:injuries_raw.txt,is out for season Parker is out for season with undisclosed
Portland,Timo George,F,Out for season,Jan 21,,-0.1,covers_raw:injuries_raw.txt,is out for season George is out for season with shoulder
Princeton,Jack Stanton,G,Out for season,Feb 13,,-0.1,covers_raw:injuries_raw.txt,is out for season Stanton is out for season with foot
Providence,Rich Barron,F/G,Out,Jan 21,,-0.07,covers_raw:injuries_raw.txt,is out indefinitely Barron is out with concussion
Providence,Jason Edwards,G,Out,Mar 12,,-0.05,covers_raw:injuries_raw.txt,is downgraded to OUT Thursday vs St. Johns Edwards is out with undisclosed
Providence,Daquan Davis,G,Out for season,Jan 21,,-0.1,covers_raw:injuries_raw.txt,is out for season Davis is out for season with knee
Providence,Jaylen Harrell,G/F,Out,Jan 21,,-0.07,covers_raw:injuries_raw.txt,is out indefinitely Harrell is out with undisclosed
